{
  "id": "openmeteo-forecast",
  "enabled": true,
  "endpoint": "/data/openmeteo/forecast",
  "method": "GET",
  "output_encoding": "json",
  "timeout": "15s",
  "input_query_strings": [
    "latitude",
    "longitude",
    "current",
    "hourly",
    "daily",
    "timezone",
    "forecast_days",
    "past_days",
    "temperature_unit",
    "wind_speed_unit",
    "precipitation_unit",
    "timeformat"
  ],
  "parameter_rules": {
    "properties": {
      "latitude": {
        "type": "number",
        "minimum": -90,
        "maximum": 90
      },
      "longitude": {
        "type": "number",
        "minimum": -180,
        "maximum": 180
      },
      "forecast_days": {
        "type": "integer",
        "minimum": 1,
        "maximum": 16
      },
      "past_days": {
        "type": "integer",
        "minimum": 0,
        "maximum": 92
      },
      "timezone": {
        "type": "string",
        "min_length": 1,
        "max_length": 100
      },
      "temperature_unit": {
        "type": "string",
        "enum": [
          "celsius",
          "fahrenheit"
        ]
      },
      "wind_speed_unit": {
        "type": "string",
        "enum": [
          "kmh",
          "ms",
          "mph",
          "kn"
        ]
      },
      "precipitation_unit": {
        "type": "string",
        "enum": [
          "mm",
          "inch"
        ]
      },
      "timeformat": {
        "type": "string",
        "enum": [
          "iso8601",
          "unixtime"
        ]
      }
    },
    "required_any_of": [
      [
        "current",
        "hourly",
        "daily"
      ]
    ]
  },
  "response_contract": {
    "success_when_data_present": true,
    "any_data_paths": [
      "current",
      "hourly",
      "daily"
    ]
  },
  "backend": {
    "host": "https://api.open-meteo.com",
    "url_pattern": "/v1/forecast",
    "method": "GET",
    "encoding": "json",
    "allow": [
      "latitude",
      "longitude",
      "generationtime_ms",
      "utc_offset_seconds",
      "timezone",
      "timezone_abbreviation",
      "elevation",
      "current_units",
      "current",
      "hourly_units",
      "hourly",
      "daily_units",
      "daily",
      "reason",
      "error"
    ],
    "resilience": {
      "rate_limit": {
        "max_rate": 10,
        "every": "1s",
        "capacity": 10
      }
    }
  }
}
