{
  "id": "openmeteo-marine",
  "enabled": true,
  "endpoint": "/data/openmeteo/marine",
  "method": "GET",
  "output_encoding": "json",
  "timeout": "25s",
  "input_query_strings": [
    "latitude",
    "longitude",
    "current",
    "hourly",
    "daily",
    "timezone",
    "forecast_days",
    "past_days",
    "start_date",
    "end_date",
    "wave_height_min",
    "wave_height_max",
    "timeformat"
  ],
  "response_contract": {
    "success_when_data_present": true,
    "any_data_paths": [
      "current",
      "hourly",
      "daily"
    ]
  },
  "backend": {
    "host": "https://marine-api.open-meteo.com",
    "url_pattern": "/v1/marine",
    "method": "GET",
    "encoding": "json",
    "allow": [
      "latitude",
      "longitude",
      "generationtime_ms",
      "utc_offset_seconds",
      "timezone",
      "timezone_abbreviation",
      "elevation",
      "current_units",
      "current",
      "hourly_units",
      "hourly",
      "daily_units",
      "daily",
      "results",
      "reason",
      "error"
    ],
    "resilience": {
      "rate_limit": {
        "max_rate": 5,
        "every": "1s",
        "capacity": 5
      }
    }
  },
  "parameter_rules": {
    "properties": {
      "latitude": {
        "type": "number",
        "minimum": -90,
        "maximum": 90
      },
      "longitude": {
        "type": "number",
        "minimum": -180,
        "maximum": 180
      },
      "start_date": {
        "type": "string",
        "pattern": "^\\d{4}-\\d{2}-\\d{2}$",
        "max_length": 10
      },
      "end_date": {
        "type": "string",
        "pattern": "^\\d{4}-\\d{2}-\\d{2}$",
        "max_length": 10
      },
      "current": {
        "type": "string",
        "min_length": 1,
        "max_length": 2000
      },
      "hourly": {
        "type": "string",
        "min_length": 1,
        "max_length": 2000
      },
      "daily": {
        "type": "string",
        "min_length": 1,
        "max_length": 2000
      },
      "forecast_days": {
        "type": "integer",
        "minimum": 1,
        "maximum": 365
      },
      "past_days": {
        "type": "integer",
        "minimum": 0,
        "maximum": 365
      }
    },
    "required_any_of": [
      [
        "latitude"
      ],
      [
        "longitude"
      ]
    ]
  }
}
