{
  "id": "dbnomics-dataset",
  "enabled": true,
  "endpoint": "/data/dbnomics/dataset/{provider_code}/{dataset_code}",
  "method": "GET",
  "output_encoding": "json",
  "timeout": "30s",
  "input_query_strings": [
    "observations",
    "facets",
    "metadata",
    "limit",
    "offset"
  ],
  "response_contract": {
    "success_when_data_present": true,
    "any_data_paths": [
      "datasets.docs",
      "series.docs"
    ]
  },
  "backend": {
    "host": "https://api.db.nomics.world",
    "url_pattern": "/v22/series/{provider_code}/{dataset_code}",
    "method": "GET",
    "encoding": "json",
    "allow": [
      "_meta",
      "datasets",
      "providers",
      "series",
      "errors"
    ],
    "resilience": {
      "rate_limit": {
        "max_rate": 1,
        "every": "1s",
        "capacity": 1
      }
    }
  },
  "path_parameters": {
    "provider_code": {
      "pattern": "^[A-Za-z0-9][A-Za-z0-9._-]{0,31}$",
      "max_length": 32
    },
    "dataset_code": {
      "pattern": "^[A-Za-z0-9][A-Za-z0-9._:-]{0,127}$",
      "max_length": 128
    }
  }
}
