{
  "id": "amap-place-detail",
  "enabled": true,
  "endpoint": "/data/amap/place/detail",
  "method": "GET",
  "output_encoding": "json",
  "timeout": "12s",
  "input_query_strings": [
    "id",
    "show_fields"
  ],
  "secret_query": {
    "name": "key",
    "env": "AMAP_API_KEY"
  },
  "response_contract": {
    "status_path": "status",
    "success_values": [
      "1"
    ],
    "error_code_path": "infocode",
    "message_path": "info",
    "any_data_paths": [
      "pois"
    ]
  },
  "backend": {
    "host": "https://restapi.amap.com",
    "url_pattern": "/v5/place/detail",
    "method": "GET",
    "encoding": "json",
    "allow": [
      "status",
      "info",
      "infocode",
      "count",
      "pois"
    ],
    "resilience": {
      "rate_limit": {
        "max_rate": 5,
        "every": "1s",
        "capacity": 5
      }
    }
  },
  "parameter_rules": {
    "properties": {
      "id": {
        "type": "string",
        "min_length": 1,
        "max_length": 200
      }
    },
    "required_any_of": [
      [
        "id"
      ]
    ]
  }
}
